  n1cat on Monday at 1:44 PM                                                                                                                                                        0.035s  MEM: 18.51% (0/3GB)
  {  home  shiro }  sudo smartctl -a /dev/sda
[sudo] password for n1cat: 
smartctl 7.2 2020-12-30 r5155 [x86_64-linux-5.15.0-136-generic] (local build)
Copyright (C) 2002-20, Bruce Allen, Christian Franke, www.smartmontools.org

=== START OF INFORMATION SECTION ===
Model Family:     Hitachi Travelstar 5K320
Device Model:     Hitachi HTS543232L9A300
Serial Number:    081009FB2400LECE8D3A
LU WWN Device Id: 5 000cca 564c60852
Firmware Version: FB4OC40C
User Capacity:    320,072,933,376 bytes [320 GB]
Sector Size:      512 bytes logical/physical
Rotation Rate:    5400 rpm
Device is:        In smartctl database [for details use: -P show]
ATA Version is:   ATA8-ACS T13/1699-D revision 3f
SATA Version is:  SATA 2.6, 3.0 Gb/s
Local Time is:    Mon Apr 21 14:18:19 2025 UTC
SMART support is: Available - device has SMART capability.
SMART support is: Enabled

=== START OF READ SMART DATA SECTION ===
SMART overall-health self-assessment test result: PASSED

General SMART Values:
Offline data collection status:  (0x00) Offline data collection activity
                                        was never started.
                                        Auto Offline Data Collection: Disabled.
Self-test execution status:      (   0) The previous self-test routine completed
                                        without error or no self-test has ever 
                                        been run.
Total time to complete Offline 
data collection:                (  645) seconds.
Offline data collection
capabilities:                    (0x5b) SMART execute Offline immediate.
                                        Auto Offline data collection on/off support.
                                        Suspend Offline collection upon new
                                        command.
                                        Offline surface scan supported.
                                        Self-test supported.
                                        No Conveyance Self-test supported.
                                        Selective Self-test supported.
SMART capabilities:            (0x0003) Saves SMART data before entering
                                        power-saving mode.
                                        Supports SMART auto save timer.
Error logging capability:        (0x01) Error logging supported.
                                        General Purpose Logging supported.
Short self-test routine 
recommended polling time:        (   2) minutes.
Extended self-test routine
recommended polling time:        ( 127) minutes.
SCT capabilities:              (0x003d) SCT Status supported.
                                        SCT Error Recovery Control supported.
                                        SCT Feature Control supported.
                                        SCT Data Table supported.

SMART Attributes Data Structure revision number: 16
Vendor Specific SMART Attributes with Thresholds:
ID# ATTRIBUTE_NAME          FLAG     VALUE WORST THRESH TYPE      UPDATED  WHEN_FAILED RAW_VALUE
  1 Raw_Read_Error_Rate     0x000b   095   095   062    Pre-fail  Always       -       12
  2 Throughput_Performance  0x0005   100   100   040    Pre-fail  Offline      -       0
  3 Spin_Up_Time            0x0007   253   253   033    Pre-fail  Always       -       0
  4 Start_Stop_Count        0x0012   099   099   000    Old_age   Always       -       2776
  5 Reallocated_Sector_Ct   0x0033   100   100   005    Pre-fail  Always       -       0
  7 Seek_Error_Rate         0x000b   100   100   067    Pre-fail  Always       -       0
  8 Seek_Time_Performance   0x0005   100   100   040    Pre-fail  Offline      -       0
  9 Power_On_Hours          0x0012   028   028   000    Old_age   Always       -       31558
 10 Spin_Retry_Count        0x0013   100   100   060    Pre-fail  Always       -       0
 12 Power_Cycle_Count       0x0032   099   099   000    Old_age   Always       -       2728
191 G-Sense_Error_Rate      0x000a   100   100   000    Old_age   Always       -       0
192 Power-Off_Retract_Count 0x0032   100   100   000    Old_age   Always       -       160
193 Load_Cycle_Count        0x0012   001   001   000    Old_age   Always       -       2879822
194 Temperature_Celsius     0x0002   144   144   000    Old_age   Always       -       38 (Min/Max 14/57)
196 Reallocated_Event_Count 0x0032   100   100   000    Old_age   Always       -       108
197 Current_Pending_Sector  0x0022   100   100   000    Old_age   Always       -       4
198 Offline_Uncorrectable   0x0008   100   100   000    Old_age   Offline      -       0
199 UDMA_CRC_Error_Count    0x000a   200   200   000    Old_age   Always       -       0
223 Load_Retry_Count        0x000a   099   099   000    Old_age   Always       -       1

SMART Error Log Version: 1
ATA Error Count: 369 (device log contains only the most recent five errors)
        CR = Command Register [HEX]
        FR = Features Register [HEX]
        SC = Sector Count Register [HEX]
        SN = Sector Number Register [HEX]
        CL = Cylinder Low Register [HEX]
        CH = Cylinder High Register [HEX]
        DH = Device/Head Register [HEX]
        DC = Device Command Register [HEX]
        ER = Error register [HEX]
        ST = Status register [HEX]
Powered_Up_Time is measured from power on, and printed as
DDd+hh:mm:SS.sss where DD=days, hh=hours, mm=minutes,
SS=sec, and sss=millisec. It "wraps" after 49.710 days.

Error 369 occurred at disk power-on lifetime: 7845 hours (326 days + 21 hours)
  When the command that caused the error occurred, the device was active or idle.

  After command completion occurred, registers were:
  ER ST SC SN CL CH DH
  -- -- -- -- -- -- --
  40 51 92 bb 12 a0 e0  Error: UNC at LBA = 0x00a012bb = 10490555

  Commands leading to the command that caused the error were:
  CR FR SC SN CL CH DH DC   Powered_Up_Time  Command/Feature_Name
  -- -- -- -- -- -- -- --  ----------------  --------------------
  42 00 00 4d 12 a0 e0 00      00:14:42.400  READ VERIFY SECTOR(S) EXT
  42 00 00 4d 12 a0 e0 00      00:14:38.200  READ VERIFY SECTOR(S) EXT
  42 00 4d 00 12 a0 e0 00      00:14:38.200  READ VERIFY SECTOR(S) EXT
  42 00 00 00 11 a0 e0 00      00:14:38.200  READ VERIFY SECTOR(S) EXT
  42 00 00 00 10 a0 e0 00      00:14:38.200  READ VERIFY SECTOR(S) EXT

Error 368 occurred at disk power-on lifetime: 7845 hours (326 days + 21 hours)
  When the command that caused the error occurred, the device was active or idle.

  After command completion occurred, registers were:
  ER ST SC SN CL CH DH
  -- -- -- -- -- -- --
  40 51 92 bb 12 a0 e0  Error: UNC at LBA = 0x00a012bb = 10490555

  Commands leading to the command that caused the error were:
  CR FR SC SN CL CH DH DC   Powered_Up_Time  Command/Feature_Name
  -- -- -- -- -- -- -- --  ----------------  --------------------
  42 00 00 4d 12 a0 e0 00      00:14:38.200  READ VERIFY SECTOR(S) EXT
  42 00 4d 00 12 a0 e0 00      00:14:38.200  READ VERIFY SECTOR(S) EXT
  42 00 00 00 11 a0 e0 00      00:14:38.200  READ VERIFY SECTOR(S) EXT
  42 00 00 00 10 a0 e0 00      00:14:38.200  READ VERIFY SECTOR(S) EXT
  42 00 00 00 0f a0 e0 00      00:14:38.200  READ VERIFY SECTOR(S) EXT

Error 367 occurred at disk power-on lifetime: 7845 hours (326 days + 21 hours)
  When the command that caused the error occurred, the device was active or idle.

  After command completion occurred, registers were:
  ER ST SC SN CL CH DH
  -- -- -- -- -- -- --
  40 51 04 bb 12 a0 e0  Error: UNC 4 sectors at LBA = 0x00a012bb = 10490555

  Commands leading to the command that caused the error were:
  CR FR SC SN CL CH DH DC   Powered_Up_Time  Command/Feature_Name
  -- -- -- -- -- -- -- --  ----------------  --------------------
  25 00 08 b7 12 a0 e0 00      00:28:09.000  READ DMA EXT
  25 00 08 97 34 03 e0 00      00:28:09.000  READ DMA EXT
  25 00 01 b7 71 ff e0 00      00:28:09.000  READ DMA EXT
  25 00 08 37 00 60 e0 00      00:28:08.900  READ DMA EXT
  25 00 01 4f 15 a0 e0 00      00:28:08.900  READ DMA EXT

Error 366 occurred at disk power-on lifetime: 7845 hours (326 days + 21 hours)
  When the command that caused the error occurred, the device was active or idle.

  After command completion occurred, registers were:
  ER ST SC SN CL CH DH
  -- -- -- -- -- -- --
  40 51 04 bb 12 a0 e0  Error: UNC 4 sectors at LBA = 0x00a012bb = 10490555

  Commands leading to the command that caused the error were:
  CR FR SC SN CL CH DH DC   Powered_Up_Time  Command/Feature_Name
  -- -- -- -- -- -- -- --  ----------------  --------------------
  25 00 08 b7 12 a0 e0 00      00:28:02.200  READ DMA EXT
  25 00 08 97 34 03 e0 00      00:28:02.200  READ DMA EXT
  25 00 01 b7 71 ff e0 00      00:28:02.200  READ DMA EXT
  25 00 08 37 00 60 e0 00      00:28:02.200  READ DMA EXT
  25 00 01 4f 15 a0 e0 00      00:28:02.200  READ DMA EXT

Error 365 occurred at disk power-on lifetime: 7845 hours (326 days + 21 hours)
  When the command that caused the error occurred, the device was active or idle.

  After command completion occurred, registers were:
  ER ST SC SN CL CH DH
  -- -- -- -- -- -- --
  40 51 05 ba 12 a0 e0  Error: UNC 5 sectors at LBA = 0x00a012ba = 10490554

  Commands leading to the command that caused the error were:
  CR FR SC SN CL CH DH DC   Powered_Up_Time  Command/Feature_Name
  -- -- -- -- -- -- -- --  ----------------  --------------------
  25 00 08 b7 12 a0 e0 00      00:27:57.600  READ DMA EXT
  25 00 08 97 34 03 e0 00      00:27:57.600  READ DMA EXT
  25 00 01 b7 71 ff e0 00      00:27:57.600  READ DMA EXT
  25 00 08 37 00 60 e0 00      00:27:57.600  READ DMA EXT
  25 00 01 4f 15 a0 e0 00      00:27:57.500  READ DMA EXT

SMART Self-test log structure revision number 1
Num  Test_Description    Status                  Remaining  LifeTime(hours)  LBA_of_first_error
# 1  Extended offline    Completed: read failure       60%     31557         219245072

SMART Selective self-test log data structure revision number 1
 SPAN  MIN_LBA  MAX_LBA  CURRENT_TEST_STATUS
    1        0        0  Not_testing
    2        0        0  Not_testing
    3        0        0  Not_testing
    4        0        0  Not_testing
    5        0        0  Not_testing
Selective self-test flags (0x0):
  After scanning selected spans, do NOT read-scan remainder of disk.
If Selective self-test is pending on power-up, resume after 0 minute delay.
